{
 "definition": {
  "attributes": [
    {"ref": "NXobject@default"}
  ],
  "category": "base",
  "children": [
    {"node": "group", "ref": "NXobject/COLLECTION"},
    {"node": "group", "ref": "NXobject/DATA"},
    {"node": "group", "ref": "NXobject/LOG"},
    {"node": "group", "ref": "NXobject/NOTE"},
    {"node": "group", "ref": "NXobject/PARAMETERS"},
    {"node": "group", "ref": "NXobject/GROUPNAME_log"},
    {"node": "dataset", "ref": "NXobject/FIELDNAME_set"},
    {"node": "dataset", "ref": "NXobject/FIELDNAME_errors"},
    {"node": "dataset", "ref": "NXobject/FIELDNAME_weights"},
    {"node": "dataset", "ref": "NXobject/FIELDNAME_mask"},
    {"node": "dataset", "ref": "NXobject/identifierNAME"},
    {"declared_by": "NXcg_primitive", "docs": ["NXcg_primitive/depends_on"], "id": "depends_on", "name": {"exact": "depends_on"}, "node": "dataset", "occurs": {"max": 1, "min": 0}, "provisional": ["Q1"], "recommended": false, "type": "NX_CHAR", "via": ["T1", "T4", "T7"]},
    {"declared_by": "NXcg_primitive", "docs": ["NXcg_primitive/dimensionality"], "enum": {"open": false, "values": [{"value": 1}, {"value": 2}, {"value": 3}]}, "id": "dimensionality", "name": {"exact": "dimensionality"}, "node": "dataset", "occurs": {"max": 1, "min": 0}, "provisional": ["Q1"], "recommended": false, "type": "NX_POSINT", "units": {"category": "NX_UNITLESS"}, "via": ["T1", "T4", "T7"]},
    {"declared_by": "NXcg_primitive", "docs": ["NXcg_primitive/cardinality"], "id": "cardinality", "name": {"exact": "cardinality"}, "node": "dataset", "occurs": {"max": 1, "min": 0}, "provisional": ["Q1"], "recommended": false, "type": "NX_POSINT", "units": {"category": "NX_UNITLESS"}, "via": ["T1", "T4", "T7"]},
    {"declared_by": "NXcg_primitive", "docs": ["NXcg_primitive/index_offset"], "id": "index_offset", "name": {"exact": "index_offset"}, "node": "dataset", "occurs": {"max": 1, "min": 0}, "provisional": ["Q1"], "recommended": false, "type": "NX_INT", "units": {"category": "NX_UNITLESS"}, "via": ["T1", "T4", "T7"]},
    {"declared_by": "NXcg_primitive", "docs": ["NXcg_primitive/indices"], "id": "indices", "name": {"exact": "indices"}, "node": "dataset", "occurs": {"max": 1, "min": 0}, "provisional": ["Q1", "Q5"], "recommended": false, "shape": {"binding": false, "dims": ["c"], "symbols": {"c": "NXcg_primitive"}}, "type": "NX_INT", "via": ["T1", "T4", "T7", "T9"]},
    {"declared_by": "NXcg_primitive", "docs": ["NXcg_primitive/center"], "id": "center", "name": {"exact": "center"}, "node": "dataset", "occurs": {"max": 1, "min": 0}, "provisional": ["Q1", "Q5"], "recommended": false, "shape": {"binding": false, "dims": ["c", "d"], "symbols": {"c": "NXcg_primitive", "d": "NXcg_primitive"}}, "type": "NX_NUMBER", "units": {"category": "NX_ANY"}, "via": ["T1", "T4", "T7", "T9"]},
    {"declared_by": "NXcg_primitive", "docs": ["NXcg_primitive/is_center_of_mass"], "id": "is_center_of_mass", "name": {"exact": "is_center_of_mass"}, "node": "dataset", "occurs": {"max": 1, "min": 0}, "provisional": ["Q1", "Q5"], "recommended": false, "shape": {"binding": false, "dims": ["c"], "symbols": {"c": "NXcg_primitive"}}, "type": "NX_BOOLEAN", "via": ["T1", "T4", "T7", "T9"]},
    {"declared_by": "NXcg_primitive", "docs": ["NXcg_primitive/shape"], "id": "shape", "name": {"exact": "shape"}, "node": "dataset", "occurs": {"max": 1, "min": 0}, "provisional": ["Q1", "Q5"], "recommended": false, "shape": {"binding": false, "dims": ["c", "d"], "symbols": {"c": "NXcg_primitive", "d": "NXcg_primitive"}}, "type": "NX_NUMBER", "units": {"category": "NX_LENGTH"}, "via": ["T1", "T4", "T7", "T9"]},
    {"declared_by": "NXcg_primitive", "docs": ["NXcg_primitive/length"], "id": "length", "name": {"exact": "length"}, "node": "dataset", "occurs": {"max": 1, "min": 0}, "provisional": ["Q1", "Q5"], "recommended": false, "shape": {"binding": false, "dims": ["c"], "symbols": {"c": "NXcg_primitive"}}, "type": "NX_NUMBER", "units": {"category": "NX_LENGTH"}, "via": ["T1", "T4", "T7", "T9"]},
    {"declared_by": "NXcg_primitive", "docs": ["NXcg_primitive/width"], "id": "width", "name": {"exact": "width"}, "node": "dataset", "occurs": {"max": 1, "min": 0}, "provisional": ["Q1", "Q5"], "recommended": false, "shape": {"binding": false, "dims": ["c"], "symbols": {"c": "NXcg_primitive"}}, "type": "NX_NUMBER", "units": {"category": "NX_LENGTH"}, "via": ["T1", "T4", "T7", "T9"]},
    {"declared_by": "NXcg_primitive", "docs": ["NXcg_primitive/height"], "id": "height", "name": {"exact": "height"}, "node": "dataset", "occurs": {"max": 1, "min": 0}, "provisional": ["Q1", "Q5"], "recommended": false, "shape": {"binding": false, "dims": ["c"], "symbols": {"c": "NXcg_primitive"}}, "type": "NX_NUMBER", "units": {"category": "NX_LENGTH"}, "via": ["T1", "T4", "T7", "T9"]},
    {"declared_by": "NXcg_primitive", "docs": ["NXcg_primitive/is_closed"], "id": "is_closed", "name": {"exact": "is_closed"}, "node": "dataset", "occurs": {"max": 1, "min": 0}, "provisional": ["Q1", "Q5"], "recommended": false, "shape": {"binding": false, "dims": ["c"], "symbols": {"c": "NXcg_primitive"}}, "type": "NX_BOOLEAN", "via": ["T1", "T4", "T7", "T9"]},
    {"declared_by": "NXcg_primitive", "docs": ["NXcg_primitive/volume"], "id": "volume", "name": {"exact": "volume"}, "node": "dataset", "occurs": {"max": 1, "min": 0}, "provisional": ["Q1", "Q5"], "recommended": false, "shape": {"binding": false, "dims": ["c"], "symbols": {"c": "NXcg_primitive"}}, "type": "NX_NUMBER", "units": {"category": "NX_ANY"}, "via": ["T1", "T4", "T7", "T9"]},
    {"declared_by": "NXcg_primitive", "docs": ["NXcg_primitive/area"], "id": "area", "name": {"exact": "area"}, "node": "dataset", "occurs": {"max": 1, "min": 0}, "provisional": ["Q1", "Q5"], "recommended": false, "shape": {"binding": false, "dims": ["c"], "symbols": {"c": "NXcg_primitive"}}, "type": "NX_NUMBER", "units": {"category": "NX_AREA"}, "via": ["T1", "T4", "T7", "T9"]},
    {"declared_by": "NXcg_primitive", "docs": ["NXcg_primitive/orientation"], "id": "orientation", "name": {"exact": "orientation"}, "node": "dataset", "occurs": {"max": 1, "min": 0}, "provisional": ["Q1", "Q5"], "recommended": false, "shape": {"binding": false, "dims": ["c", "d"], "symbols": {"c": "NXcg_primitive", "d": "NXcg_primitive"}}, "type": "NX_NUMBER", "units": {"category": "NX_DIMENSIONLESS"}, "via": ["T1", "T4", "T7", "T9"]},
    {"declared_by": "NXcg_primitive", "docs": ["NXcg_primitive/is_mesh"], "id": "is_mesh", "name": {"exact": "is_mesh"}, "node": "dataset", "occurs": {"max": 1, "min": 0}, "provisional": ["Q1"], "recommended": false, "type": "NX_BOOLEAN", "via": ["T1", "T4", "T7"]},
    {"declared_by": "NXcg_primitive", "docs": ["NXcg_primitive/is_triangle_mesh"], "id": "is_triangle_mesh", "name": {"exact": "is_triangle_mesh"}, "node": "dataset", "occurs": {"max": 1, "min": 0}, "provisional": ["Q1"], "recommended": false, "type": "NX_BOOLEAN", "via": ["T1", "T4", "T7"]},
    {"declared_by": "NXcg_primitive", "docs": ["NXcg_primitive/is_surface_mesh"], "id": "is_surface_mesh", "name": {"exact": "is_surface_mesh"}, "node": "dataset", "occurs": {"max": 1, "min": 0}, "provisional": ["Q1"], "recommended": false, "type": "NX_BOOLEAN", "via": ["T1", "T4", "T7"]},
    {"declared_by": "NXcg_primitive", "docs": ["NXcg_primitive/is_geodesic_mesh"], "id": "is_geodesic_mesh", "name": {"exact": "is_geodesic_mesh"}, "node": "dataset", "occurs": {"max": 1, "min": 0}, "provisional": ["Q1"], "recommended": false, "type": "NX_BOOLEAN", "via": ["T1", "T4", "T7"]},
    {"declared_by": "NXcg_primitive", "docs": ["NXcg_primitive/description"], "id": "description", "name": {"exact": "description"}, "node": "dataset", "occurs": {"max": 1, "min": 0}, "provisional": ["Q1"], "recommended": false, "type": "NX_CHAR", "via": ["T0", "T1", "T4", "T7"]},
    {"class": "NXcg_unit_normal", "declared_by": "NXcg_primitive", "id": "vertex_normal", "name": {"exact": "vertex_normal"}, "node": "group", "occurs": {"max": 1, "min": 0}, "provisional": ["Q1"], "recommended": false, "via": ["T1", "T4", "T7"]},
    {"class": "NXcg_unit_normal", "declared_by": "NXcg_primitive", "id": "edge_normal", "name": {"exact": "edge_normal"}, "node": "group", "occurs": {"max": 1, "min": 0}, "provisional": ["Q1"], "recommended": false, "via": ["T1", "T4", "T7"]},
    {"class": "NXcg_unit_normal", "declared_by": "NXcg_primitive", "id": "face_normal", "name": {"exact": "face_normal"}, "node": "group", "occurs": {"max": 1, "min": 0}, "provisional": ["Q1"], "recommended": false, "via": ["T1", "T4", "T7"]}
  ],
  "class": "NXcg_primitive",
  "extends": "NXobject",
  "lossy": [],
  "provisional": [],
  "require": [],
  "source": "base_classes/NXcg_primitive.nxdl.xml",
  "status": "base",
  "symbols": ["c", "d"],
  "undeclared": {"attribute": "report", "dataset": "report", "group": "report"},
  "via": []
 },
 "nxds": "0.1",
 "requires": [],
 "specialisations": {}
}
