{
 "definition": {
  "attributes": [
    {"ref": "NXobject@default"}
  ],
  "category": "base",
  "children": [
    {"node": "group", "ref": "NXobject/COLLECTION"},
    {"node": "group", "ref": "NXobject/DATA"},
    {"node": "group", "ref": "NXobject/LOG"},
    {"node": "group", "ref": "NXobject/NOTE"},
    {"node": "group", "ref": "NXobject/PARAMETERS"},
    {"node": "group", "ref": "NXobject/GROUPNAME_log"},
    {"node": "dataset", "ref": "NXobject/FIELDNAME_set"},
    {"node": "dataset", "ref": "NXobject/FIELDNAME_errors"},
    {"node": "dataset", "ref": "NXobject/FIELDNAME_weights"},
    {"node": "dataset", "ref": "NXobject/FIELDNAME_mask"},
    {"node": "dataset", "ref": "NXobject/identifierNAME"},
    {"node": "dataset", "ref": "NXcomponent/applied"},
    {"node": "dataset", "ref": "NXcomponent/name"},
    {"node": "dataset", "ref": "NXcomponent/description"},
    {"node": "dataset", "ref": "NXcomponent/inputs"},
    {"node": "dataset", "ref": "NXcomponent/outputs"},
    {"node": "group", "ref": "NXcomponent/FABRICATION"},
    {"node": "group", "ref": "NXcomponent/PROGRAM"},
    {"node": "group", "ref": "NXcomponent/ENVIRONMENT"},
    {"declared_by": "NXcomponent", "docs": ["NXcomponent/depends_on", "NXflipper/depends_on"], "id": "depends_on", "name": {"exact": "depends_on"}, "node": "dataset", "occurs": {"max": 1, "min": 0}, "provisional": ["Q1"], "recommended": false, "refined_by": ["NXflipper"], "type": "NX_CHAR", "via": ["T1", "T4", "T7"]},
    {"node": "group", "ref": "NXcomponent/TRANSFORMATIONS"},
    {"declared_by": "NXflipper", "enum": {"open": false, "values": [{"value": "coil"}, {"value": "current-sheet"}]}, "id": "type", "name": {"exact": "type"}, "node": "dataset", "occurs": {"max": 1, "min": 0}, "provisional": ["Q1"], "recommended": false, "type": "NX_CHAR", "via": ["T0", "T1", "T4", "T7"]},
    {"declared_by": "NXflipper", "docs": ["NXflipper/flip_turns"], "id": "flip_turns", "name": {"exact": "flip_turns"}, "node": "dataset", "occurs": {"max": 1, "min": 0}, "provisional": ["Q1"], "recommended": false, "type": "NX_FLOAT", "units": {"category": "NX_PER_LENGTH"}, "via": ["T1", "T4", "T7"]},
    {"declared_by": "NXflipper", "docs": ["NXflipper/comp_turns"], "id": "comp_turns", "name": {"exact": "comp_turns"}, "node": "dataset", "occurs": {"max": 1, "min": 0}, "provisional": ["Q1"], "recommended": false, "type": "NX_FLOAT", "units": {"category": "NX_PER_LENGTH"}, "via": ["T1", "T4", "T7"]},
    {"declared_by": "NXflipper", "docs": ["NXflipper/guide_turns"], "id": "guide_turns", "name": {"exact": "guide_turns"}, "node": "dataset", "occurs": {"max": 1, "min": 0}, "provisional": ["Q1"], "recommended": false, "type": "NX_FLOAT", "units": {"category": "NX_PER_LENGTH"}, "via": ["T1", "T4", "T7"]},
    {"declared_by": "NXflipper", "docs": ["NXflipper/flip_current"], "id": "flip_current", "name": {"exact": "flip_current"}, "node": "dataset", "occurs": {"max": 1, "min": 0}, "provisional": ["Q1"], "recommended": false, "type": "NX_FLOAT", "units": {"category": "NX_CURRENT"}, "via": ["T1", "T4", "T7"]},
    {"declared_by": "NXflipper", "docs": ["NXflipper/comp_current"], "id": "comp_current", "name": {"exact": "comp_current"}, "node": "dataset", "occurs": {"max": 1, "min": 0}, "provisional": ["Q1"], "recommended": false, "type": "NX_FLOAT", "units": {"category": "NX_CURRENT"}, "via": ["T1", "T4", "T7"]},
    {"declared_by": "NXflipper", "docs": ["NXflipper/guide_current"], "id": "guide_current", "name": {"exact": "guide_current"}, "node": "dataset", "occurs": {"max": 1, "min": 0}, "provisional": ["Q1"], "recommended": false, "type": "NX_FLOAT", "units": {"category": "NX_CURRENT"}, "via": ["T1", "T4", "T7"]},
    {"declared_by": "NXflipper", "docs": ["NXflipper/thickness"], "id": "thickness", "name": {"exact": "thickness"}, "node": "dataset", "occurs": {"max": 1, "min": 0}, "provisional": ["Q1"], "recommended": false, "type": "NX_FLOAT", "units": {"category": "NX_LENGTH"}, "via": ["T1", "T4", "T7"]}
  ],
  "class": "NXflipper",
  "extends": "NXcomponent",
  "lossy": [],
  "provisional": [],
  "require": [],
  "source": "base_classes/NXflipper.nxdl.xml",
  "status": "base",
  "symbols": [],
  "undeclared": {"attribute": "report", "dataset": "report", "group": "report"},
  "via": []
 },
 "nxds": "0.1",
 "requires": [],
 "specialisations": {}
}
