{
 "definition": {
  "attributes": [
    {"ref": "NXobject@default"}
  ],
  "category": "base",
  "children": [
    {"node": "group", "ref": "NXobject/COLLECTION"},
    {"node": "group", "ref": "NXobject/DATA"},
    {"class": "NXdata", "declared_by": "NXbending_magnet", "docs": ["NXbending_magnet/spectrum"], "id": "spectrum", "name": {"exact": "spectrum"}, "node": "group", "occurs": {"max": 1, "min": 0}, "provisional": ["Q1", "Q4", "Q11"], "recommended": false, "refines": "DATA", "via": ["T1", "T2", "T4", "T6", "T7", "T18"]},
    {"node": "group", "ref": "NXobject/LOG"},
    {"node": "group", "ref": "NXobject/NOTE"},
    {"node": "group", "ref": "NXobject/PARAMETERS"},
    {"node": "group", "ref": "NXobject/GROUPNAME_log"},
    {"node": "dataset", "ref": "NXobject/FIELDNAME_set"},
    {"node": "dataset", "ref": "NXobject/FIELDNAME_errors"},
    {"node": "dataset", "ref": "NXobject/FIELDNAME_weights"},
    {"node": "dataset", "ref": "NXobject/FIELDNAME_mask"},
    {"node": "dataset", "ref": "NXobject/identifierNAME"},
    {"node": "dataset", "ref": "NXcomponent/applied"},
    {"node": "dataset", "ref": "NXcomponent/name"},
    {"node": "dataset", "ref": "NXcomponent/description"},
    {"node": "dataset", "ref": "NXcomponent/inputs"},
    {"node": "dataset", "ref": "NXcomponent/outputs"},
    {"node": "group", "ref": "NXcomponent/FABRICATION"},
    {"node": "group", "ref": "NXcomponent/PROGRAM"},
    {"node": "group", "ref": "NXcomponent/ENVIRONMENT"},
    {"declared_by": "NXcomponent", "docs": ["NXcomponent/depends_on", "NXbending_magnet/depends_on"], "id": "depends_on", "name": {"exact": "depends_on"}, "node": "dataset", "occurs": {"max": 1, "min": 0}, "provisional": ["Q1"], "recommended": false, "refined_by": ["NXbending_magnet"], "type": "NX_CHAR", "via": ["T1", "T4", "T7"]},
    {"node": "group", "ref": "NXcomponent/TRANSFORMATIONS"},
    {"declared_by": "NXbending_magnet", "id": "critical_energy", "name": {"exact": "critical_energy"}, "node": "dataset", "occurs": {"max": 1, "min": 0}, "provisional": ["Q1"], "recommended": false, "type": "NX_FLOAT", "units": {"category": "NX_ENERGY"}, "via": ["T1", "T4", "T7"]},
    {"declared_by": "NXbending_magnet", "id": "bending_radius", "name": {"exact": "bending_radius"}, "node": "dataset", "occurs": {"max": 1, "min": 0}, "provisional": ["Q1"], "recommended": false, "type": "NX_FLOAT", "units": {"category": "NX_LENGTH"}, "via": ["T1", "T4", "T7"]},
    {"declared_by": "NXbending_magnet", "docs": ["NXbending_magnet/magnetic_field"], "id": "magnetic_field", "name": {"exact": "magnetic_field"}, "node": "dataset", "occurs": {"max": 1, "min": 0}, "provisional": ["Q1"], "recommended": false, "type": "NX_FLOAT", "units": {"category": "NX_CURRENT"}, "via": ["T1", "T4", "T7"]},
    {"declared_by": "NXbending_magnet", "docs": ["NXbending_magnet/accepted_photon_beam_divergence"], "id": "accepted_photon_beam_divergence", "name": {"exact": "accepted_photon_beam_divergence"}, "node": "dataset", "occurs": {"max": 1, "min": 0}, "provisional": ["Q1"], "recommended": false, "type": "NX_FLOAT", "units": {"category": "NX_LENGTH"}, "via": ["T1", "T4", "T7"]},
    {"declared_by": "NXbending_magnet", "docs": ["NXbending_magnet/source_distance_x"], "id": "source_distance_x", "name": {"exact": "source_distance_x"}, "node": "dataset", "occurs": {"max": 1, "min": 0}, "provisional": ["Q1"], "recommended": false, "type": "NX_FLOAT", "units": {"category": "NX_LENGTH"}, "via": ["T1", "T4", "T7"]},
    {"declared_by": "NXbending_magnet", "docs": ["NXbending_magnet/source_distance_y"], "id": "source_distance_y", "name": {"exact": "source_distance_y"}, "node": "dataset", "occurs": {"max": 1, "min": 0}, "provisional": ["Q1"], "recommended": false, "type": "NX_FLOAT", "units": {"category": "NX_LENGTH"}, "via": ["T1", "T4", "T7"]},
    {"declared_by": "NXbending_magnet", "docs": ["NXbending_magnet/divergence_x_plus"], "id": "divergence_x_plus", "name": {"exact": "divergence_x_plus"}, "node": "dataset", "occurs": {"max": 1, "min": 0}, "provisional": ["Q1"], "recommended": false, "type": "NX_FLOAT", "units": {"category": "NX_ANGLE"}, "via": ["T1", "T4", "T7"]},
    {"declared_by": "NXbending_magnet", "docs": ["NXbending_magnet/divergence_x_minus"], "id": "divergence_x_minus", "name": {"exact": "divergence_x_minus"}, "node": "dataset", "occurs": {"max": 1, "min": 0}, "provisional": ["Q1"], "recommended": false, "type": "NX_FLOAT", "units": {"category": "NX_ANGLE"}, "via": ["T1", "T4", "T7"]},
    {"declared_by": "NXbending_magnet", "docs": ["NXbending_magnet/divergence_y_plus"], "id": "divergence_y_plus", "name": {"exact": "divergence_y_plus"}, "node": "dataset", "occurs": {"max": 1, "min": 0}, "provisional": ["Q1"], "recommended": false, "type": "NX_FLOAT", "units": {"category": "NX_ANGLE"}, "via": ["T1", "T4", "T7"]},
    {"declared_by": "NXbending_magnet", "docs": ["NXbending_magnet/divergence_y_minus"], "id": "divergence_y_minus", "name": {"exact": "divergence_y_minus"}, "node": "dataset", "occurs": {"max": 1, "min": 0}, "provisional": ["Q1"], "recommended": false, "type": "NX_FLOAT", "units": {"category": "NX_ANGLE"}, "via": ["T1", "T4", "T7"]},
    {"class": "NXgeometry", "declared_by": "NXbending_magnet", "deprecated": "Use the field `depends_on` and :ref:`NXtransformations` to position the bending magnet and NXoff_geometry to describe its shape instead", "docs": ["NXbending_magnet/GEOMETRY"], "id": "GEOMETRY", "name": {"any": true}, "node": "group", "occurs": {"max": "unbounded", "min": 0}, "provisional": ["Q1", "Q11"], "recommended": false, "via": ["T1", "T2", "T4", "T7"]},
    {"class": "NXoff_geometry", "declared_by": "NXbending_magnet", "docs": ["NXbending_magnet/OFF_GEOMETRY"], "id": "OFF_GEOMETRY", "name": {"any": true}, "node": "group", "occurs": {"max": "unbounded", "min": 0}, "provisional": ["Q1", "Q11"], "recommended": false, "via": ["T1", "T2", "T6", "T7"]}
  ],
  "class": "NXbending_magnet",
  "extends": "NXcomponent",
  "lossy": [],
  "provisional": [],
  "require": [],
  "source": "base_classes/NXbending_magnet.nxdl.xml",
  "status": "base",
  "symbols": [],
  "undeclared": {"attribute": "report", "dataset": "report", "group": "report"},
  "via": []
 },
 "nxds": "0.1",
 "requires": [],
 "specialisations": {}
}
