{
 "definition": {
  "attributes": [
    {"ref": "NXobject@default"},
    {"ref": "NXparameters@model"}
  ],
  "category": "base",
  "children": [
    {"node": "group", "ref": "NXobject/COLLECTION"},
    {"node": "group", "ref": "NXobject/DATA"},
    {"node": "group", "ref": "NXobject/LOG"},
    {"node": "group", "ref": "NXobject/NOTE"},
    {"node": "group", "ref": "NXobject/PARAMETERS"},
    {"node": "group", "ref": "NXobject/GROUPNAME_log"},
    {"node": "dataset", "ref": "NXobject/FIELDNAME_set"},
    {"node": "dataset", "ref": "NXobject/FIELDNAME_errors"},
    {"node": "dataset", "ref": "NXobject/FIELDNAME_weights"},
    {"node": "dataset", "ref": "NXobject/FIELDNAME_mask"},
    {"node": "dataset", "ref": "NXobject/identifierNAME"},
    {"node": "dataset", "ref": "NXparameters/PARAMETER"},
    {"attributes": [{"declared_by": "NXparameters", "id": "units", "name": {"exact": "units"}, "occurs": {"max": 1, "min": 0}, "provisional": ["Q1"], "recommended": false, "type": "NX_CHAR", "via": ["T0", "T1", "T4"]}, {"declared_by": "NXparameters", "docs": ["NXparameters/PARAMETER@error"], "id": "error", "name": {"exact": "error"}, "occurs": {"max": 1, "min": 0}, "provisional": ["Q1"], "recommended": false, "type": "NX_NUMBER", "via": ["T1", "T4"]}, {"declared_by": "NXparameters", "docs": ["NXparameters/PARAMETER@description"], "id": "description", "name": {"exact": "description"}, "occurs": {"max": 1, "min": 0}, "provisional": ["Q1"], "recommended": false, "type": "NX_CHAR", "via": ["T0", "T1", "T4"]}, {"declared_by": "NXparameters", "docs": ["NXparameters/PARAMETER@expression"], "id": "expression", "name": {"exact": "expression"}, "occurs": {"max": 1, "min": 0}, "provisional": ["Q1"], "recommended": false, "type": "NX_CHAR", "via": ["T0", "T1", "T4"]}, {"declared_by": "NXparameters", "docs": ["NXparameters/PARAMETER@initial"], "id": "initial", "name": {"exact": "initial"}, "occurs": {"max": 1, "min": 0}, "provisional": ["Q1"], "recommended": false, "type": "NX_NUMBER", "via": ["T1", "T4"]}, {"declared_by": "NXparameters", "docs": ["NXparameters/PARAMETER@max"], "id": "max", "name": {"exact": "max"}, "occurs": {"max": 1, "min": 0}, "provisional": ["Q1"], "recommended": false, "type": "NX_NUMBER", "via": ["T1", "T4"]}, {"declared_by": "NXparameters", "docs": ["NXparameters/PARAMETER@min"], "id": "min", "name": {"exact": "min"}, "occurs": {"max": 1, "min": 0}, "provisional": ["Q1"], "recommended": false, "type": "NX_NUMBER", "via": ["T1", "T4"]}, {"declared_by": "NXparameters", "docs": ["NXparameters/PARAMETER@vary"], "id": "vary", "name": {"exact": "vary"}, "occurs": {"max": 1, "min": 0}, "provisional": ["Q1"], "recommended": false, "type": "NX_BOOLEAN", "via": ["T1", "T4"]}], "declared_by": "NXmatch_filter", "docs": ["NXparameters/PARAMETER", "NXmatch_filter/method"], "enum": {"open": false, "values": [{"value": "whitelist"}, {"value": "blacklist"}]}, "id": "method", "name": {"exact": "method"}, "node": "dataset", "occurs": {"max": 1, "min": 0}, "provisional": ["Q1", "Q3", "Q4"], "recommended": false, "refines": "PARAMETER", "type": "NX_CHAR", "via": ["T1", "T3", "T4", "T7", "T18"]},
    {"attributes": [{"declared_by": "NXparameters", "id": "units", "name": {"exact": "units"}, "occurs": {"max": 1, "min": 0}, "provisional": ["Q1"], "recommended": false, "type": "NX_CHAR", "via": ["T0", "T1", "T4"]}, {"declared_by": "NXparameters", "docs": ["NXparameters/PARAMETER@error"], "id": "error", "name": {"exact": "error"}, "occurs": {"max": 1, "min": 0}, "provisional": ["Q1"], "recommended": false, "type": "NX_NUMBER", "via": ["T1", "T4"]}, {"declared_by": "NXparameters", "docs": ["NXparameters/PARAMETER@description"], "id": "description", "name": {"exact": "description"}, "occurs": {"max": 1, "min": 0}, "provisional": ["Q1"], "recommended": false, "type": "NX_CHAR", "via": ["T0", "T1", "T4"]}, {"declared_by": "NXparameters", "docs": ["NXparameters/PARAMETER@expression"], "id": "expression", "name": {"exact": "expression"}, "occurs": {"max": 1, "min": 0}, "provisional": ["Q1"], "recommended": false, "type": "NX_CHAR", "via": ["T0", "T1", "T4"]}, {"declared_by": "NXparameters", "docs": ["NXparameters/PARAMETER@initial"], "id": "initial", "name": {"exact": "initial"}, "occurs": {"max": 1, "min": 0}, "provisional": ["Q1"], "recommended": false, "type": "NX_NUMBER", "via": ["T1", "T4"]}, {"declared_by": "NXparameters", "docs": ["NXparameters/PARAMETER@max"], "id": "max", "name": {"exact": "max"}, "occurs": {"max": 1, "min": 0}, "provisional": ["Q1"], "recommended": false, "type": "NX_NUMBER", "via": ["T1", "T4"]}, {"declared_by": "NXparameters", "docs": ["NXparameters/PARAMETER@min"], "id": "min", "name": {"exact": "min"}, "occurs": {"max": 1, "min": 0}, "provisional": ["Q1"], "recommended": false, "type": "NX_NUMBER", "via": ["T1", "T4"]}, {"declared_by": "NXparameters", "docs": ["NXparameters/PARAMETER@vary"], "id": "vary", "name": {"exact": "vary"}, "occurs": {"max": 1, "min": 0}, "provisional": ["Q1"], "recommended": false, "type": "NX_BOOLEAN", "via": ["T1", "T4"]}], "declared_by": "NXmatch_filter", "docs": ["NXparameters/PARAMETER", "NXmatch_filter/match"], "id": "match", "name": {"exact": "match"}, "node": "dataset", "occurs": {"max": 1, "min": 0}, "provisional": ["Q1", "Q3", "Q4", "Q5"], "recommended": false, "refines": "PARAMETER", "shape": {"binding": false, "dims": ["n_values"], "symbols": {"n_values": "NXmatch_filter"}}, "type": "NX_NUMBER", "units": {"category": "NX_UNITLESS"}, "via": ["T1", "T3", "T4", "T7", "T9", "T18"]}
  ],
  "class": "NXmatch_filter",
  "extends": "NXparameters",
  "lossy": [],
  "provisional": [],
  "require": [],
  "source": "contributed_definitions/NXmatch_filter.nxdl.xml",
  "status": "contributed",
  "symbols": ["n_values"],
  "undeclared": {"attribute": "report", "dataset": "report", "group": "report"},
  "via": []
 },
 "nxds": "0.1",
 "requires": [],
 "specialisations": {}
}
